{
  "family": "column-collapse",
  "geometry_id": "g017",
  "geometry": {
    "aspect_ratio": 2.0,
    "column_width_m": 0.2
  },
  "packing_seed": 3,
  "solver": "warp-dem",
  "solver_version": "1.17.0",
  "dimensions": 2,
  "particle_diameter_m": 0.004,
  "connectivity_radius_m": 0.01,
  "frame_interval_s": 0.01,
  "bounds_m": [
    0.0,
    0.0,
    1.6,
    0.8
  ],
  "frame_times_s": [
    0.0,
    0.01,
    0.02,
    0.03,
    0.04,
    0.05,
    0.06,
    0.07,
    0.08,
    0.09,
    0.1,
    0.11,
    0.12,
    0.13,
    0.14,
    0.15,
    0.16,
    0.17,
    0.18,
    0.19,
    0.2,
    0.21,
    0.22,
    0.23,
    0.24,
    0.25,
    0.26,
    0.27,
    0.28,
    0.29,
    0.3,
    0.31,
    0.32,
    0.33,
    0.34,
    0.35,
    0.36,
    0.37,
    0.38,
    0.39,
    0.4,
    0.41,
    0.42,
    0.43,
    0.44,
    0.45,
    0.46,
    0.47,
    0.48,
    0.49,
    0.5,
    0.51,
    0.52,
    0.53,
    0.54,
    0.55,
    0.56,
    0.57,
    0.58,
    0.59,
    0.6
  ],
  "particle_count": 2400,
  "particle_types": [
    "grain"
  ],
  "material": {
    "density_kg_per_m3": {
      "value": 2650,
      "source": "knowledge-table",
      "ref": "granular.quartz_particle_density",
      "verification": "UNVERIFIED"
    },
    "sliding_friction": {
      "value": 0.52,
      "source": "calibration",
      "ref": "lit-crushed-gravel-cma-es"
    },
    "rolling_friction": {
      "value": 0.1,
      "source": "recipe"
    },
    "restitution": {
      "value": 0.3,
      "source": "knowledge-table",
      "ref": "granular.restitution_gravel",
      "verification": "UNVERIFIED"
    },
    "youngs_modulus_pa": {
      "value": 50000000.0,
      "source": "recipe"
    }
  },
  "rest_time_s": 0.6,
  "store": {
    "format": "zarr",
    "path": "/abs/x",
    "sha256": "1111111111111111111111111111111111111111111111111111111111111111"
  },
  "label": "calibrated synthetic — not validated against real data"
}
